{
  "appointmentId": "APT-123456",
  "appointmentType": "Initial Screening",
  "appointmentDate": "20250715",
  "appointmentTime": "0930",
  "appointmentStatusCode": "B",
  "appointmentStatusDisplay": "Booked",
  "appointmentBookedByCode": "H",
  "appointmentBookedByDisplay": "Hospital",
  "episodeID": "EPI-789012",
  "managingEntityId": "ORG-456",
  "appointmentFacilityCode": "FAC-001",
  "appointmentLocationCode": "LOC-123",
  "appointmentLocationName": "Main Screening Centre",
  "appointmentLocationNameAlias": "NHS Screening Centre",
  "appointmentLocationAddressLine1": "123 Health Street",
  "appointmentLocationAddressLine2": "Screening Wing",
  "appointmentLocationAddressLine3": "Building A",
  "appointmentLocationAddressLine4": "Healthcare Campus",
  "appointmentLocationAddressLine5": "North Zone",
  "appointmentLocationPostalCode": "HX1 1XX",
  "holdingClinicIndicator": true,
  "screeningBatchId": "BATCH-202507"
}
